{
  "$schema": "https://json-schema.org/draft/2020-12/schema",
  "$id": "https://schemas.sovereignops.local/ingest-connectors/mcp/resources.schema.json",
  "title": "Ingest connector MCP resources envelope",
  "type": "object",
  "additionalProperties": false,
  "required": [
    "schemaVersion",
    "generatedAt",
    "connectorId",
    "localOnly",
    "resources"
  ],
  "properties": {
    "schemaVersion": {
      "type": "string",
      "const": "ingest-connector-mcp-resources/v1",
      "enum": [
        "ingest-connector-mcp-resources/v1"
      ]
    },
    "generatedAt": {
      "type": "string",
      "minLength": 1,
      "pattern": "^\\d{4}-\\d{2}-\\d{2}T\\d{2}:\\d{2}:\\d{2}(?:\\.\\d{3})?Z$"
    },
    "connectorId": {
      "type": "string",
      "minLength": 1,
      "pattern": "^(?!.*(?:(?:\\b[A-Za-z]:[\\\\/][^\\s\"',;)}\\]]+|\\\\\\\\[^\\\\\\s\"',;)}\\]]+[\\\\][^\\s\"',;)}\\]]+|file://[^\\s\"',;)}\\]]+|/(?:Users|home|var|tmp|private|mnt|Volumes)/[^\\s\"',;)}\\]]+)|(?:^|[\\\\/])\\.codex-private(?:[\\\\/]|$)|[pP][rR][iI][vV][aA][tT][eE][- _]?[pP][lL][aA][nN](?:[- _]?[pP][aA][cC][kK])?|[pP][rR][iI][vV][aA][tT][eE][- _]?[mM][aA][rR][kK][eE][rR]|(?:[bB][eE][aA][rR][eE][rR]\\s+[A-Za-z0-9._~+/=-]{8,}|-----BEGIN [A-Z ]*PRIVATE KEY-----|(?:sk|rk|pk|tok|pat|npm|ghp|gho)_[A-Za-z0-9_-]{8,}|(?:sk|rk|pat|glpat|github_pat)-[A-Za-z0-9_-]{8,})|(?:[aA][pP][iI][_-]?[kK][eE][yY]|[aA][uU][tT][hH][oO][rR][iI][zZ][aA][tT][iI][oO][nN]|[bB][eE][aA][rR][eE][rR]|[cC][rR][eE][dD][eE][nN][tT][iI][aA][lL]|[pP][aA][sS][sS][wW][oO][rR][dD]|[pP][aA][sS][sS][pP][hH][rR][aA][sS][eE]|[pP][rR][iI][vV][aA][tT][eE][_-]?[kK][eE][yY]|[sS][eE][cC][rR][eE][tT]|[sS][eE][sS][sS][iI][oO][nN][_-]?[tT][oO][kK][eE][nN]|[tT][oO][kK][eE][nN])))[a-z0-9][a-z0-9._-]{0,63}$"
    },
    "localOnly": {
      "type": "boolean",
      "const": true,
      "enum": [
        true
      ]
    },
    "resources": {
      "type": "array",
      "items": {
        "$schema": "https://json-schema.org/draft/2020-12/schema",
        "title": "Ingest connector MCP resource summary",
        "type": "object",
        "additionalProperties": false,
        "required": [
          "id",
          "uri",
          "name",
          "description",
          "mimeType",
          "textBytes"
        ],
        "properties": {
          "id": {
            "type": "string",
            "minLength": 1,
            "pattern": "^(?!.*(?:(?:\\b[A-Za-z]:[\\\\/][^\\s\"',;)}\\]]+|\\\\\\\\[^\\\\\\s\"',;)}\\]]+[\\\\][^\\s\"',;)}\\]]+|file://[^\\s\"',;)}\\]]+|/(?:Users|home|var|tmp|private|mnt|Volumes)/[^\\s\"',;)}\\]]+)|(?:^|[\\\\/])\\.codex-private(?:[\\\\/]|$)|[pP][rR][iI][vV][aA][tT][eE][- _]?[pP][lL][aA][nN](?:[- _]?[pP][aA][cC][kK])?|[pP][rR][iI][vV][aA][tT][eE][- _]?[mM][aA][rR][kK][eE][rR]|(?:[bB][eE][aA][rR][eE][rR]\\s+[A-Za-z0-9._~+/=-]{8,}|-----BEGIN [A-Z ]*PRIVATE KEY-----|(?:sk|rk|pk|tok|pat|npm|ghp|gho)_[A-Za-z0-9_-]{8,}|(?:sk|rk|pat|glpat|github_pat)-[A-Za-z0-9_-]{8,})|(?:[aA][pP][iI][_-]?[kK][eE][yY]|[aA][uU][tT][hH][oO][rR][iI][zZ][aA][tT][iI][oO][nN]|[bB][eE][aA][rR][eE][rR]|[cC][rR][eE][dD][eE][nN][tT][iI][aA][lL]|[pP][aA][sS][sS][wW][oO][rR][dD]|[pP][aA][sS][sS][pP][hH][rR][aA][sS][eE]|[pP][rR][iI][vV][aA][tT][eE][_-]?[kK][eE][yY]|[sS][eE][cC][rR][eE][tT]|[sS][eE][sS][sS][iI][oO][nN][_-]?[tT][oO][kK][eE][nN]|[tT][oO][kK][eE][nN])))[a-z][a-z0-9._-]{0,63}$"
          },
          "uri": {
            "type": "string",
            "minLength": 1,
            "pattern": "^ingest://([a-z0-9][a-z0-9._-]{0,63})/[A-Za-z0-9][A-Za-z0-9._~:/?#\\[\\]@!$&'()*+,;=%-]{0,191}$"
          },
          "name": {
            "type": "string",
            "minLength": 1,
            "pattern": "^(?!.*(?:(?:\\b[A-Za-z]:[\\\\/][^\\s\"',;)}\\]]+|\\\\\\\\[^\\\\\\s\"',;)}\\]]+[\\\\][^\\s\"',;)}\\]]+|file://[^\\s\"',;)}\\]]+|/(?:Users|home|var|tmp|private|mnt|Volumes)/[^\\s\"',;)}\\]]+)|(?:^|[\\\\/])\\.codex-private(?:[\\\\/]|$)|[pP][rR][iI][vV][aA][tT][eE][- _]?[pP][lL][aA][nN](?:[- _]?[pP][aA][cC][kK])?|[pP][rR][iI][vV][aA][tT][eE][- _]?[mM][aA][rR][kK][eE][rR]|(?:[bB][eE][aA][rR][eE][rR]\\s+[A-Za-z0-9._~+/=-]{8,}|-----BEGIN [A-Z ]*PRIVATE KEY-----|(?:sk|rk|pk|tok|pat|npm|ghp|gho)_[A-Za-z0-9_-]{8,}|(?:sk|rk|pat|glpat|github_pat)-[A-Za-z0-9_-]{8,})|(?:[aA][pP][iI][_-]?[kK][eE][yY]|[aA][uU][tT][hH][oO][rR][iI][zZ][aA][tT][iI][oO][nN]|[bB][eE][aA][rR][eE][rR]|[cC][rR][eE][dD][eE][nN][tT][iI][aA][lL]|[pP][aA][sS][sS][wW][oO][rR][dD]|[pP][aA][sS][sS][pP][hH][rR][aA][sS][eE]|[pP][rR][iI][vV][aA][tT][eE][_-]?[kK][eE][yY]|[sS][eE][cC][rR][eE][tT]|[sS][eE][sS][sS][iI][oO][nN][_-]?[tT][oO][kK][eE][nN]|[tT][oO][kK][eE][nN]))).*\\S.*$"
          },
          "description": {
            "type": "string",
            "minLength": 1,
            "pattern": "^(?!.*(?:(?:\\b[A-Za-z]:[\\\\/][^\\s\"',;)}\\]]+|\\\\\\\\[^\\\\\\s\"',;)}\\]]+[\\\\][^\\s\"',;)}\\]]+|file://[^\\s\"',;)}\\]]+|/(?:Users|home|var|tmp|private|mnt|Volumes)/[^\\s\"',;)}\\]]+)|(?:^|[\\\\/])\\.codex-private(?:[\\\\/]|$)|[pP][rR][iI][vV][aA][tT][eE][- _]?[pP][lL][aA][nN](?:[- _]?[pP][aA][cC][kK])?|[pP][rR][iI][vV][aA][tT][eE][- _]?[mM][aA][rR][kK][eE][rR]|(?:[bB][eE][aA][rR][eE][rR]\\s+[A-Za-z0-9._~+/=-]{8,}|-----BEGIN [A-Z ]*PRIVATE KEY-----|(?:sk|rk|pk|tok|pat|npm|ghp|gho)_[A-Za-z0-9_-]{8,}|(?:sk|rk|pat|glpat|github_pat)-[A-Za-z0-9_-]{8,})|(?:[aA][pP][iI][_-]?[kK][eE][yY]|[aA][uU][tT][hH][oO][rR][iI][zZ][aA][tT][iI][oO][nN]|[bB][eE][aA][rR][eE][rR]|[cC][rR][eE][dD][eE][nN][tT][iI][aA][lL]|[pP][aA][sS][sS][wW][oO][rR][dD]|[pP][aA][sS][sS][pP][hH][rR][aA][sS][eE]|[pP][rR][iI][vV][aA][tT][eE][_-]?[kK][eE][yY]|[sS][eE][cC][rR][eE][tT]|[sS][eE][sS][sS][iI][oO][nN][_-]?[tT][oO][kK][eE][nN]|[tT][oO][kK][eE][nN]))).*\\S.*$"
          },
          "mimeType": {
            "type": "string",
            "minLength": 1,
            "pattern": "^[^\\s/]+/[^\\s]+$"
          },
          "textBytes": {
            "type": "integer",
            "minimum": 0
          }
        }
      }
    }
  }
}
